{
  "$schema": "https://json-schema.org/draft/2020-12/schema",
  "$id": "https://hardware-system-designer.local/schemas/component-schema-v1.schema.json",
  "title": "Hardware System Designer Component Schema V1",
  "description": "Canonical published component definition for Hardware System Designer V1.",
  "type": "object",
  "additionalProperties": false,
  "required": [
    "schema_version",
    "component_id",
    "revision",
    "identity",
    "classification",
    "lifecycle",
    "provenance",
    "pins",
    "ports",
    "resources",
    "address_capabilities",
    "notes",
    "created_at",
    "updated_at",
    "revision_notes"
  ],
  "properties": {
    "schema_version": { "const": "hwsd.component/1" },
    "component_id": { "$ref": "#/$defs/componentId" },
    "revision": { "type": "integer", "minimum": 1 },
    "identity": { "$ref": "#/$defs/identity" },
    "classification": { "$ref": "#/$defs/classification" },
    "lifecycle": { "$ref": "#/$defs/lifecycle" },
    "provenance": { "$ref": "#/$defs/provenance" },
    "pins": {
      "type": "array",
      "items": { "$ref": "#/$defs/pin" }
    },
    "ports": {
      "type": "array",
      "items": { "$ref": "#/$defs/port" }
    },
    "resources": {
      "type": "array",
      "items": { "$ref": "#/$defs/resource" }
    },
    "address_capabilities": {
      "type": "array",
      "items": { "$ref": "#/$defs/addressCapability" }
    },
    "notes": {
      "type": "array",
      "items": { "$ref": "#/$defs/note" }
    },
    "created_at": { "$ref": "#/$defs/timestamp" },
    "updated_at": { "$ref": "#/$defs/timestamp" },
    "revision_notes": { "$ref": "#/$defs/nonEmptyString" }
  },
  "$defs": {
    "nonEmptyString": {
      "type": "string",
      "minLength": 1
    },
    "timestamp": {
      "type": "string",
      "format": "date-time"
    },
    "componentId": {
      "type": "string",
      "pattern": "^CMP-[A-Z0-9][A-Z0-9_-]*$"
    },
    "localId": {
      "type": "string",
      "pattern": "^[A-Z]+-[A-Z0-9][A-Z0-9_-]*$"
    },
    "nonNegativeNumber": {
      "type": "number",
      "minimum": 0
    },
    "voltage": {
      "type": "object",
      "additionalProperties": false,
      "required": ["value", "unit"],
      "properties": {
        "value": { "type": "number" },
        "unit": { "const": "V" }
      }
    },
    "current": {
      "type": "object",
      "additionalProperties": false,
      "required": ["value", "unit"],
      "properties": {
        "value": { "$ref": "#/$defs/nonNegativeNumber" },
        "unit": { "const": "A" }
      }
    },
    "frequency": {
      "type": "object",
      "additionalProperties": false,
      "required": ["value", "unit"],
      "properties": {
        "value": { "$ref": "#/$defs/nonNegativeNumber" },
        "unit": { "const": "Hz" }
      }
    },
    "voltageRange": {
      "type": "object",
      "additionalProperties": false,
      "minProperties": 1,
      "properties": {
        "min": { "$ref": "#/$defs/voltage" },
        "nominal": { "$ref": "#/$defs/voltage" },
        "max": { "$ref": "#/$defs/voltage" }
      }
    },
    "identity": {
      "type": "object",
      "additionalProperties": false,
      "required": ["name"],
      "properties": {
        "name": { "$ref": "#/$defs/nonEmptyString" },
        "manufacturer": { "$ref": "#/$defs/nonEmptyString" },
        "part_number": { "$ref": "#/$defs/nonEmptyString" },
        "family": { "$ref": "#/$defs/nonEmptyString" },
        "variant": { "$ref": "#/$defs/nonEmptyString" }
      }
    },
    "classification": {
      "type": "object",
      "additionalProperties": false,
      "required": ["category", "abstraction"],
      "properties": {
        "category": {
          "enum": [
            "MICROCONTROLLER",
            "SENSOR",
            "ACTUATOR",
            "RELAY",
            "DISPLAY",
            "ETHERNET_CONTROLLER",
            "GSM_LTE_MODULE",
            "RF_MODULE",
            "BATTERY",
            "CHARGER",
            "CONNECTOR",
            "EXTERNAL_SERVER_CLOUD",
            "COMPUTER_SBC",
            "POWER_SUPPLY",
            "VOLTAGE_REGULATOR",
            "INTERFACE_CONVERTER_TRANSCEIVER",
            "COMMUNICATION_MODULE",
            "GENERIC_IC",
            "GENERIC_MODULE",
            "GENERIC_BOARD",
            "CUSTOM_COMPONENT"
          ]
        },
        "abstraction": {
          "enum": ["RAW_IC", "MODULE", "FINISHED_SENSOR", "BOARD", "SYSTEM", "CUSTOM"]
        }
      }
    },
    "lifecycle": {
      "type": "object",
      "additionalProperties": false,
      "required": ["status"],
      "properties": {
        "status": {
          "enum": [
            "AI_GENERATED",
            "REVIEW_REQUIRED",
            "USER_REVIEWED",
            "PENDING_ADMIN_VERIFICATION",
            "VERIFIED",
            "DEPRECATED",
            "DISABLED"
          ]
        },
        "status_reason": { "$ref": "#/$defs/nonEmptyString" },
        "verified_by": { "$ref": "#/$defs/nonEmptyString" },
        "verified_at": { "$ref": "#/$defs/timestamp" },
        "superseded_by_revision": { "type": "integer", "minimum": 2 }
      },
      "allOf": [
        {
          "if": { "properties": { "status": { "const": "VERIFIED" } }, "required": ["status"] },
          "then": { "required": ["verified_by", "verified_at"] },
          "else": {
            "not": {
              "anyOf": [
                { "required": ["verified_by"] },
                { "required": ["verified_at"] }
              ]
            }
          }
        },
        {
          "if": {
            "properties": { "status": { "enum": ["DEPRECATED", "DISABLED"] } },
            "required": ["status"]
          },
          "then": { "required": ["status_reason"] }
        }
      ]
    },
    "datasheet": {
      "type": "object",
      "additionalProperties": false,
      "required": ["datasheet_id", "filename", "media_type", "byte_size", "storage_ref", "uploaded_at"],
      "properties": {
        "datasheet_id": { "$ref": "#/$defs/localId" },
        "filename": { "$ref": "#/$defs/nonEmptyString" },
        "media_type": { "const": "application/pdf" },
        "byte_size": { "type": "integer", "minimum": 1, "maximum": 10485760 },
        "storage_ref": { "$ref": "#/$defs/nonEmptyString" },
        "sha256": {
          "type": "string",
          "pattern": "^[a-fA-F0-9]{64}$"
        },
        "page_count": { "type": "integer", "minimum": 1, "maximum": 100 },
        "uploaded_at": { "$ref": "#/$defs/timestamp" }
      }
    },
    "fieldEvidence": {
      "type": "object",
      "additionalProperties": false,
      "required": ["field"],
      "properties": {
        "field": {
          "type": "string",
          "pattern": "^/"
        },
        "confidence": {
          "type": "number",
          "minimum": 0,
          "maximum": 1
        },
        "datasheet_id": { "$ref": "#/$defs/localId" },
        "pages": {
          "type": "array",
          "minItems": 1,
          "uniqueItems": true,
          "items": { "type": "integer", "minimum": 1, "maximum": 100 }
        },
        "source_excerpt": { "$ref": "#/$defs/nonEmptyString" },
        "reviewer_note": { "$ref": "#/$defs/nonEmptyString" }
      }
    },
    "provenance": {
      "type": "object",
      "additionalProperties": false,
      "required": ["origin", "datasheets", "field_evidence"],
      "properties": {
        "origin": {
          "enum": ["AI_DATASHEET_EXTRACTION", "MANUAL", "IMPORTED", "MIGRATED"]
        },
        "extracted_at": { "$ref": "#/$defs/timestamp" },
        "extraction_model": { "$ref": "#/$defs/nonEmptyString" },
        "datasheets": {
          "type": "array",
          "items": { "$ref": "#/$defs/datasheet" }
        },
        "field_evidence": {
          "type": "array",
          "items": { "$ref": "#/$defs/fieldEvidence" }
        }
      },
      "allOf": [
        {
          "if": {
            "properties": { "origin": { "const": "AI_DATASHEET_EXTRACTION" } },
            "required": ["origin"]
          },
          "then": {
            "required": ["extracted_at", "extraction_model"],
            "properties": { "datasheets": { "minItems": 1 } }
          }
        }
      ]
    },
    "requirement": {
      "enum": ["REQUIRED", "OPTIONAL"]
    },
    "pinDirection": {
      "enum": ["INPUT", "OUTPUT", "BIDIRECTIONAL", "POWER_INPUT", "POWER_OUTPUT", "PASSIVE"]
    },
    "alternateFunction": {
      "type": "object",
      "additionalProperties": false,
      "required": ["function_id", "interface_type", "signal"],
      "properties": {
        "function_id": { "$ref": "#/$defs/localId" },
        "interface_type": { "$ref": "#/$defs/interfaceType" },
        "signal": { "$ref": "#/$defs/nonEmptyString" },
        "resource_id": { "$ref": "#/$defs/localId" },
        "channel": { "$ref": "#/$defs/nonEmptyString" },
        "mux_group": { "$ref": "#/$defs/nonEmptyString" }
      }
    },
    "pin": {
      "type": "object",
      "additionalProperties": false,
      "required": [
        "pin_id",
        "number",
        "name",
        "direction",
        "electrical_type",
        "requirement",
        "alternate_functions"
      ],
      "properties": {
        "pin_id": { "$ref": "#/$defs/localId" },
        "number": { "$ref": "#/$defs/nonEmptyString" },
        "name": { "$ref": "#/$defs/nonEmptyString" },
        "gpio_number": { "$ref": "#/$defs/nonEmptyString" },
        "direction": { "$ref": "#/$defs/pinDirection" },
        "electrical_type": {
          "enum": [
            "DIGITAL",
            "ANALOG",
            "POWER",
            "GROUND",
            "OPEN_DRAIN",
            "OPEN_COLLECTOR",
            "DIFFERENTIAL",
            "PASSIVE",
            "CUSTOM"
          ]
        },
        "requirement": { "$ref": "#/$defs/requirement" },
        "logic_voltage": { "$ref": "#/$defs/voltageRange" },
        "absolute_voltage": { "$ref": "#/$defs/voltageRange" },
        "max_source_current": { "$ref": "#/$defs/current" },
        "max_sink_current": { "$ref": "#/$defs/current" },
        "alternate_functions": {
          "type": "array",
          "items": { "$ref": "#/$defs/alternateFunction" }
        }
      }
    },
    "interfaceType": {
      "enum": [
        "GPIO_INPUT",
        "GPIO_OUTPUT",
        "GPIO_BIDIRECTIONAL",
        "PWM",
        "INTERRUPT",
        "DIGITAL_CUSTOM",
        "UART_TTL",
        "RS232",
        "RS485",
        "CAN",
        "LIN",
        "I2C",
        "SPI",
        "ONE_WIRE",
        "ANALOG_INPUT",
        "ANALOG_OUTPUT",
        "ADC_INPUT",
        "DAC_OUTPUT",
        "ANALOG_0_10V",
        "ANALOG_4_20MA",
        "ETHERNET",
        "WIFI",
        "BLE",
        "GSM",
        "LTE",
        "LORA",
        "RF_CUSTOM",
        "DRY_CONTACT",
        "RELAY_CONTACT",
        "ENABLE",
        "RESET",
        "POWER_INPUT",
        "POWER_OUTPUT",
        "BATTERY_INPUT",
        "BATTERY_OUTPUT",
        "CHARGER_INPUT",
        "CHARGER_OUTPUT",
        "CUSTOM"
      ]
    },
    "interface": {
      "type": "object",
      "additionalProperties": false,
      "required": ["type", "bus_mode"],
      "properties": {
        "type": { "$ref": "#/$defs/interfaceType" },
        "custom_type": { "$ref": "#/$defs/nonEmptyString" },
        "bus_mode": {
          "enum": ["POINT_TO_POINT", "SHARED_BUS", "MULTI_DROP", "WIRELESS", "NOT_APPLICABLE"]
        },
        "logic_voltage": { "$ref": "#/$defs/voltageRange" },
        "max_frequency": { "$ref": "#/$defs/frequency" },
        "protocol": { "$ref": "#/$defs/nonEmptyString" }
      },
      "allOf": [
        {
          "if": {
            "properties": {
              "type": { "enum": ["CUSTOM", "DIGITAL_CUSTOM", "RF_CUSTOM"] }
            },
            "required": ["type"]
          },
          "then": { "required": ["custom_type"] },
          "else": { "not": { "required": ["custom_type"] } }
        }
      ]
    },
    "binding": {
      "type": "object",
      "additionalProperties": false,
      "properties": {
        "pin_id": { "$ref": "#/$defs/localId" },
        "function_id": { "$ref": "#/$defs/localId" },
        "resource_id": { "$ref": "#/$defs/localId" },
        "channel": { "$ref": "#/$defs/nonEmptyString" }
      },
      "anyOf": [
        { "required": ["pin_id"] },
        { "required": ["resource_id"] }
      ]
    },
    "power": {
      "type": "object",
      "additionalProperties": false,
      "required": ["role"],
      "properties": {
        "role": { "enum": ["SOURCE", "LOAD", "BIDIRECTIONAL"] },
        "voltage": { "$ref": "#/$defs/voltageRange" },
        "typical_current": { "$ref": "#/$defs/current" },
        "max_current": { "$ref": "#/$defs/current" },
        "peak_current": { "$ref": "#/$defs/current" },
        "regulation": {
          "enum": ["REGULATED", "UNREGULATED", "BATTERY", "UNKNOWN"]
        },
        "polarity": {
          "enum": ["POSITIVE", "NEGATIVE", "AC", "NOT_APPLICABLE"]
        }
      }
    },
    "port": {
      "type": "object",
      "additionalProperties": false,
      "required": ["port_id", "name", "requirement", "direction", "interface", "bindings"],
      "properties": {
        "port_id": { "$ref": "#/$defs/localId" },
        "name": { "$ref": "#/$defs/nonEmptyString" },
        "requirement": { "$ref": "#/$defs/requirement" },
        "direction": { "enum": ["INPUT", "OUTPUT", "BIDIRECTIONAL", "PASSIVE"] },
        "interface": { "$ref": "#/$defs/interface" },
        "bindings": {
          "type": "array",
          "items": { "$ref": "#/$defs/binding" }
        },
        "power": { "$ref": "#/$defs/power" },
        "description": { "$ref": "#/$defs/nonEmptyString" }
      }
    },
    "resourceType": {
      "enum": ["GPIO", "UART", "SPI", "I2C", "ADC", "DAC", "PWM", "CAN", "LIN", "ONE_WIRE", "ETHERNET", "CUSTOM"]
    },
    "resourceChannel": {
      "type": "object",
      "additionalProperties": false,
      "required": ["channel", "signal"],
      "properties": {
        "channel": { "$ref": "#/$defs/nonEmptyString" },
        "signal": { "$ref": "#/$defs/nonEmptyString" },
        "optional": { "type": "boolean", "default": false }
      }
    },
    "pinAssignment": {
      "type": "object",
      "additionalProperties": false,
      "required": ["signal", "pin_id", "function_id"],
      "properties": {
        "signal": { "$ref": "#/$defs/nonEmptyString" },
        "pin_id": { "$ref": "#/$defs/localId" },
        "function_id": { "$ref": "#/$defs/localId" }
      }
    },
    "pinMapping": {
      "type": "object",
      "additionalProperties": false,
      "required": ["mapping_id", "assignments"],
      "properties": {
        "mapping_id": { "$ref": "#/$defs/localId" },
        "assignments": {
          "type": "array",
          "minItems": 1,
          "items": { "$ref": "#/$defs/pinAssignment" }
        }
      }
    },
    "resource": {
      "type": "object",
      "additionalProperties": false,
      "required": ["resource_id", "type", "name", "share_mode", "channels", "compatible_pin_mappings"],
      "properties": {
        "resource_id": { "$ref": "#/$defs/localId" },
        "type": { "$ref": "#/$defs/resourceType" },
        "custom_type": { "$ref": "#/$defs/nonEmptyString" },
        "name": { "$ref": "#/$defs/nonEmptyString" },
        "share_mode": { "enum": ["EXCLUSIVE", "SHARED_BUS", "CHANNELIZED"] },
        "channels": {
          "type": "array",
          "items": { "$ref": "#/$defs/resourceChannel" }
        },
        "compatible_pin_mappings": {
          "type": "array",
          "items": { "$ref": "#/$defs/pinMapping" }
        }
      },
      "allOf": [
        {
          "if": { "properties": { "type": { "const": "CUSTOM" } }, "required": ["type"] },
          "then": { "required": ["custom_type"] },
          "else": { "not": { "required": ["custom_type"] } }
        }
      ]
    },
    "addressCapability": {
      "type": "object",
      "additionalProperties": false,
      "required": ["address_id", "port_id", "kind", "mode"],
      "properties": {
        "address_id": { "$ref": "#/$defs/localId" },
        "port_id": { "$ref": "#/$defs/localId" },
        "kind": { "enum": ["I2C_7_BIT", "I2C_10_BIT", "MODBUS_RTU_SLAVE"] },
        "mode": { "enum": ["FIXED", "SELECTABLE", "USER_CONFIGURABLE"] },
        "allowed_values": {
          "type": "array",
          "uniqueItems": true,
          "items": { "type": "integer", "minimum": 0, "maximum": 1023 }
        },
        "range": {
          "type": "object",
          "additionalProperties": false,
          "required": ["min", "max"],
          "properties": {
            "min": { "type": "integer", "minimum": 0, "maximum": 1023 },
            "max": { "type": "integer", "minimum": 0, "maximum": 1023 }
          }
        }
      },
      "allOf": [
        {
          "if": { "properties": { "mode": { "const": "FIXED" } }, "required": ["mode"] },
          "then": {
            "required": ["allowed_values"],
            "properties": { "allowed_values": { "minItems": 1, "maxItems": 1 } },
            "not": { "required": ["range"] }
          }
        },
        {
          "if": { "properties": { "mode": { "const": "SELECTABLE" } }, "required": ["mode"] },
          "then": {
            "required": ["allowed_values"],
            "properties": { "allowed_values": { "minItems": 2 } },
            "not": { "required": ["range"] }
          }
        },
        {
          "if": { "properties": { "mode": { "const": "USER_CONFIGURABLE" } }, "required": ["mode"] },
          "then": {
            "required": ["range"],
            "not": { "required": ["allowed_values"] }
          }
        }
      ]
    },
    "note": {
      "type": "object",
      "additionalProperties": false,
      "required": ["note_id", "text", "severity"],
      "properties": {
        "note_id": { "$ref": "#/$defs/localId" },
        "text": { "$ref": "#/$defs/nonEmptyString" },
        "severity": { "enum": ["INFO", "WARNING", "CRITICAL"] },
        "applies_to": { "type": "string", "pattern": "^/" }
      }
    }
  }
}
