{
  "schema_version": "hwsd.component/1",
  "component_id": "CMP-MINIMAL",
  "revision": 1,
  "identity": { "name": "Minimal component" },
  "classification": { "category": "CUSTOM_COMPONENT", "abstraction": "CUSTOM" },
  "lifecycle": { "status": "REVIEW_REQUIRED" },
  "provenance": { "origin": "MANUAL", "datasheets": [], "field_evidence": [] },
  "pins": [],
  "ports": [],
  "resources": [],
  "address_capabilities": [],
  "notes": [],
  "created_at": "2026-01-01T00:00:00.000Z",
  "updated_at": "2026-01-01T00:00:00.000Z",
  "revision_notes": "Initial fixture"
}
